,name,product_cat_lv3,conf
2732,นีเวียเมนโรลออนแบล็คไวท์,deodorants and body scent,1.0
2733,คิซ่ามาส์กชาร์โคลเจลเฟซ,sliced bread,0.2
2734,MBLแป้งฟิตมีแมทควบคุมมัน.,pet health care,0.2
2735,ส.ขอนแก่นหมูยอโบราณ,local sausages,0.4
2736,ฮานาโซลสครับมิกซ์เบอร์รี่&ซากุระ,tofu ,0.2
2737,ไลฟฟอร์ดรองพื้นเอ็กตร้ามอยส์เจอร์R,body lotion,0.2
2738,เคที่ดอลล์สกินนี่บราวไลท์ช็อกโกแลต(),sunscreen,0.2
2739,เคเอไวท์เคลียร์,facial toner,0.2
2740,แสงโสมกลม,dried soup ingredients,0.2
2741,ปีโป้เยลลี่กลิ่นโยเกิร์ต,gummy and jelly,0.8
2742,โมเดสสลิมสปิริตไม่มีปีก,toothbrush,0.6
2743,น้ำทิพย์น้ำดื่ม,drinking water,1.0
2744,ดีโด้น้ำผลไม้หวานเย็นหลอด,ready to drink tea,0.4
2745,รสดีเมนูแป้งชุบทอดเผ็ดร้อน,bread crumbs and crispy flour,0.4
2746,พัดโบกแป้งข้าวสาลี,flour,0.8
2747,อาทแร็ทกลู,rodent traps and poison,0.2
2748,เนสกาแฟโกลด์เครมมาขวด,instant coffee,1.0
2749,สกิตเติ้ลส์ลูกอมหลอด,soft candies,0.2
2750,Fresh&Joyน้ำมะพร้าวผสมวุ้นมะพร้าว,flavored yogurt,0.6
2751,บริ๊งค์คอลลาเจนเปปไทด์,vitamins and supplements,0.4
2752,สก๊อตรังนกพรีเมี่ยมไซลิทอล,instant coffee,0.2
2753,ดีโด้น้ำสตรอเบอรี่ผสมวิตามินซี,health and beauty care,0.2
2754,ดอยคำน้ำสตรอเบอร์รี่,100% juice,0.4
2755,มอร์นิ่งคิสยาทาเล็บแมทสีเทา(T),body lotion,0.2
2756,โดนัทท์ไดอะแทลลี่ลดน้ำหนัก,continuous air fresheners,1.0
2757,ซีลีโกะสาหร่ายทะเลปรุงรส,seasoned seaweed,1.0
2758,เบสท์โคเรียเซรั่มทีทรีแอคเน่,facial moisturizer,0.8
2759,เซนส์&ซอฟท์ผ้าอ้อมผู้ใหญ่เทปM,adult diapers tape,0.6
2760,โอวัลตินช็อกโกสูตร,flavored uht milk,1.0
2761,ครัวสยามน้ำจิ้มไก่,corn chips and popcorn,0.2
2762,บรีสเอกเซลลิควิคคอมฟอร์ทม่วง,liquid detergent,0.6
2763,ซันสแนครสโนริสาหร่าย,nuts and seed snacks,0.2
2764,คาร์เนชั่นพลัสนมข้นหวาน,condensed milk,1.0
2765,เกาลูนวุ้นเส้นเกาหลี,chilled local deli,0.2
2766,เดนทิสเต้แปรงสีฟันพลัสไวท์อิตาลี,toothbrush,0.2
2767,ยูสตาร์แอนตี้แอคเน่แอนด์เบลมมิชเจล,facial cleanser,0.4
2768,บิโอเรUVซีซีมิลค์,facial sunscreen,0.4
2769,มิเนเร่น้ำแร่,mineral water,0.6
2770,ดาวน์นี่ซักผ้าลิควิคมิสทีค,fabric softener,0.6
2771,ซิตร้าโลชั่นพีชไวท์ออร่าเจล,body lotion,1.0
2772,เกษตรทองข้าวหอมคัดพิเศษ(/),jasmine rice,0.8
2773,คาลบี้ดั้งเดิม,prawn chips,1.0
2774,ยันฮีวิตามินวอเตอร์,functional drinks,0.4
2775,เอ็มแอนด์เอ็มมิลค์พิคแอนด์มิกซ์.,chocolate,1.0
2776,ไทยซอสเซสไส้กรอกรมควันมินิ,sausages,0.2
2777,เซนส์&ซอฟท์แผ่นรองซับเด็ก,adult diapers tape,0.2
2778,ดาวน์นี่ซักผ้าสูตรตากผ้าในที่ร่ม,liquid detergent,0.8
2779,อาทเจ็ทโกลด์ลาเวนเดอร์,insecticide sprays,0.6
2780,บูเต้แป้งซุปเปอร์ออยล์คอนโทรล,body lotion,0.6
2781,โรซ่าซอสหอยนางรม,fish sauce,0.6
2782,โพลี-ไบรท์ฟองน้ำหุ้มตาข่ายซิลเวอร์,sponges,0.6
2783,ริกลี่ย์ดับเบิ้ลมินต์เปปเปอร์.,hard candies,0.6
2784,ชุดเสริมทักษะตัวต่อคละแบบ,incontinence pads,0.4
2785,อาทเจ็ทเทอร์ไมท์.ไร้สารแต่งกลิ่น,insecticide sprays,0.6
2786,ชีววิถีลูกประคบเปือย,chilled desserts,0.2
2787,ฟลอเร่สบู่ขมิ้น,mineral water,0.4
2788,ดีนี่ปรับผ้านิวบอร์นสีเขียว,baby fabric softener,0.2
2789,ดีนี่ออร์แกนิคแป้งเด็กสีเขียว,baby powder,0.2
2790,บิโอเรUVอะควาริชเอสเซนเจลSPF,facial sunscreen,1.0
2791,A-Homeผ้าไมโครไฟเบอร์,mops,0.2
2792,อาทเจ็ทพิงค์ไร้สารแต่งกลิ่น,insecticide sprays,0.6
2793,ถุงเท้าเด็กคละแบบ,baby diapers tape,0.6
2794,แฮนดี้เฮิร์บไนท์ไนท์,toothpaste,0.2
2795,NATURขวดนมทรงกลมฝาบู๊ท,body care accessories,0.2
2796,นีเวียเมนดีโอสเปรย์คูลพาวเดอร์,deodorants and body scent,1.0
2797,บอลการ์ตูนขนาด,chips and rice paper,0.4
2798,แคร์ฟรีออกซิเจนเฟรช,panty liners,1.0
2799,ซิมิแลคแอลเอฟสูตร,infant formula (0 to 6 months),0.2
2800,ไดเรคเตอร์ทอยคอลลี่เฮาส์.,gummy and jelly,0.2
2801,แอนมัมมาเทอร์น่ารสอิงลิชมอลต์,maternity milk powder,0.4
2802,MC--A(RO),cola,0.8
2803,โปรวาเมดUVไบรท์SPF,acne medication,0.2
2804,Carproครีมขัดเงารถยนต์.,car care,0.4
2805,กูนน์แพ้นท์SJBM,baby diapers pants,0.8
2806,อีโวลต้าถ่านAALR,batteries,0.4
2807,ดีแคชซูพรีมสีผมน้ำตาลบลอนด์(B),tea bag,0.2
2808,ฮานาโซลโลชั่นมิกซ์เบอร์รี่&ซากุระ,tofu ,0.2
2809,เคที่ดอลล์มาส์กชีทจุยซี่โทเมโท,sunscreen,0.2
2810,ดีโด้น้ำองุ่นผสมวิตามินซี,liquid soap,0.4
2811,นีเวียดีโอโรลออนเอ็กตร้าไวท์,deodorants and body scent,1.0
2812,คิงส์สเตลล่าทอยเล็ทเฟรชเจลมะกรูด,glass cleaners,0.2
2813,สิวันนาอายบราวดินสอเขียนคิ้วสีดำ,eyes and brows,1.0
2814,แว็กซ์วันซันบล็อก,car care,0.2
2815,เอลเซ่รสมะพร้าว,cakes and pies,0.2
2816,ฮัลโหลคิตตี้,insect repellent,0.2
2817,ราสยานน้ำมันมะพร้าว,toothpaste,0.2
2818,โรจูคิสแอคเน่พอร์เลสไฮโดรเจลมาส์ก,facial mask,0.6
2819,โลแลนแชมพูปิดขาวน้ำตาลประกายแดง(N),hair coloring,1.0
2820,คอลเกตยาสีฟันโททอลแอดวานซ์เฟรช,toothpaste,1.0
2821,บิวสตาชายน์กลอสลิปทินท์พีชออเรจน์,toothpaste,0.4
2822,หวีใหญ่ฟรุ้งฟริ้ง(),chinese sausage and dried meat,0.2
2823,รีโอไลท์พีชและบรั่นดี,biscuit and cookies,0.6
2824,น้ำเกลือล้างแผลซาไลน์แคร์,first aid and bandages,0.4
2825,ดินสอไม้,stationery,1.0
2826,แพนทีนแชมพูคัลเลอร์แอนด์เฟิร์ม,shampoo,1.0
2827,U.RA.Iอายบราว+มาสคาร่าบอนนี่น้ำตาลเข้ม,eyes and brows,1.0
2828,กระดาษโพสอิทแบบเรียบ,cotton and accessories,0.4
2829,มิตรผลน้ำตาลไลท์ชูการ์,coffee sugar,0.4
2830,ทิปโก้น้ำทับทิมผสมผลไม้,100% juice,1.0
2831,ดาวน์นี่ซักผ้าลิควิคแดริ่ง,liquid detergent,1.0
2832,ยาหม่องเสลดพังพอนกรีนเฮิร์บ,toothpaste,0.2
2833,เกลดสปอร์ตนิวคาร์,continuous air fresheners,0.6
2834,ฟ้าไทยซุปผงรสหมู+ช้อนจีน,msg bouillon cube and powder,1.0
2835,สิวันนาอายบราวSE(),eyes and brows,0.8
2836,FALCONครีมเทียมข้นหวาน,condensed milk,1.0
2837,แบรนด์เจนยูลูทีน่าพลัส,nutrition drinks,0.4
2838,ช้อยส์คุกกี้ชอคชิพ,ready to drink tea,0.2
2839,เจอร์เกนส์โลชั่นอัลตร้าฮีลลิ่ง,body lotion,0.4
2840,ทองการ์เด้นอัลมอนด์อบน้ำผึ้ง,nuts and seed snacks,1.0
2841,แฟนต้าครีมโซดา.,flavored soft drinks,1.0
2842,NATURแองเจิ้ลผ้ายางญี่ปุ่น,chocolate,0.2
2843,ซันซิลเพอฟูมแชมพูเดซี่พีช,shampoo,0.6
2844,แพนทีนแชมพูโทเทิลดาเมจแคร์,shampoo,1.0
2845,เจเล่ไลท์เฟรชชี่รสสตรอเบอรี่,gummy and jelly,0.4
2846,รอยัลบิวตี้สบู่คอลลาเจนวิตซี,functional drinks,0.2
2847,ไฮเนเก้นขวด,non-alcoholic,0.6
2848,ฮานาโซลวินเทอร์ครัช,talcum powder,0.2
2849,ครัวตะวันซอสปรุงรสเจ,oyster sauce,0.8
2850,นกแก้วสบู่ทานาคา,bar soap,0.6
2851,การองสบู่ผลไม้รวม,bar soap,0.2
2852,โบย่าคิวเท็นโลชั่นไวท์เทนนิ่งกลูต้าไธโอน,facial cleanser,0.2
2853,สคอร์นข้าวโพดทอดกรอบรสฮ๊อตชิลลี่,rice crackers and flour chips,0.6
2854,เอเวอร์กรีนกระต่ายสำลีแผ่น,cotton and accessories,0.8
2855,เกรซคิดส์แปรงล้างจุกหัวฟองน้ำคละสี,liquid soap,0.2
2856,โมมิจิโลชั่นกลูต้าไข่มุก ,shampoo,0.2
2857,โชโช่ขนมเวเฟอร์ช็อกโกแลตสตรอเบอร์รี่,chocolate,0.4
2858,วิสกัสพ็อกเก็ตปลาทู,cat dry food,1.0
2859,นีเวียเพิร์ลลี่ไวท์เดย์,facial cleanser,0.4
2860,ภูเขาทองซีอิ๊วดำสูตรมืออาชีพ,seasoning and dipping sauce,0.4
2861,คอลลี่กลูตาซีพลัส,soy sauce,0.2
2862,ซอฟท์เท็กซ์แผ่นรองL,adult diapers tape,0.2
2863,โสมอินซัม,functional drinks,0.2
2864,เฟสต้าโกลด์ฟรีซดรายคอฟฟี่ขวด,coffee creamers,0.6
2865,จูจูเน่ลิปครีมแมทออเร้นจ์สเปลล์,crackers,0.2
2866,ลอรีอัลUVอินสแตนท์ไวท์SPF,facial moisturizer,0.4
2867,ดาวน์นี่ปรับผ้านุ่มแอนตี้แบค,fabric softener,1.0
2868,หวีสัตว์เลี้ยง,pet grooming,0.2
2869,มาลัยรักชุดสังฆทาน.,monk gift baskets,1.0
2870,โซฟีแผ่นอนามัยลองไวด์แอนตี้แบคซีท,panty liners,1.0
2871,พอนด์สเอสเซนส์เอจยูธ,facial moisturizer,0.6
2872,อสร.น้ำจิ้มบ๊วย,seasoning and dipping sauce,0.4
2873,บิโอเรUVบอดี้เซรั่มไวท์,facial cleanser,0.2
2874,ยาอมสเตร็ปซิลวิตามินซี(ส้ม),hard candies,0.4
2875,ยาอมสมุนไพรมะแว้ง(บ๊วย)ซอง,insecticide coils,0.2
2876,ยิลเลตผู้หญิงซิมพลีวีนัส,shaving and hair remover,1.0
2877,โก๋แก่พลัสหิมพานต์อบเกลือ,nuts and seed snacks,1.0
2878,ฟันวาริเค้กรสชีส,cakes,0.2
2879,ตราชั่งกะปิ,"shrimp paste,chilli paste and curry paste",0.2
2880,สุธารสพริกไทยเม็ดดำ,"shrimp paste,chilli paste and curry paste",0.4
2881,สิวันนาบลัชออนสีส้ม(),blush on,0.2
2882,ยูสตาร์อายบราวซิกเนเจอร์น้ำตาลเข้ม(),eyes and brows,1.0
2883,โอบิวซ์อายไลเนอร์เพ็นซิลOB,eyes and brows,0.8
2884,ลอรีอัลUVแมทท์&เฟรชSPF,facial sunscreen,0.2
2885,ดีแคชทรีทเม้นท์เอ็กซ์ตร้าชายน์,shampoo,0.4
2886,โกโก้คิตโดเรม่อนลูกอมสอดไส้รสนม,hard candies,0.4
2887,ครีมาท็อป,coffee creamers,0.4
2888,บรีสเอกเซลสีม่วง,liquid detergent,0.4
2889,เกลดเจลฟรอรัลเพอเฟกชั่น,aerosol air fresheners,0.2
2890,วาสลีนอินเทนซีฟแคร์ดีพรีสโตร์,body lotion,0.8
2891,เคที่ดอลล์บูสติ้งครีมเรดดี้,functional drinks,0.2
2892,มอร์นิ่งคิสยาทาเล็บสีเงาม่วงกะปิ,body lotion,0.2
2893,ซื่อสัตย์ผงซักฟอก,canned fish,0.2
2894,อิงอรสบู่ขมิ้นชัน,bar soap,1.0
2895,วิสทร้าบีคอมเพล็กซ์วิตามินบีรวม,functional drinks,0.6
2896,เบบี้เลิฟเทปNB,baby diapers tape,1.0
2897,เนสกาแฟโกลด์,instant coffee,0.6
2898,หมอนรองคอบนรถ,cotton and accessories,1.0
2899,เซอร์เทนตี้แผ่นรองซับL,adult diapers pant,0.8
2900,เคสAirpodsคละแบบ(),facial blotters and wipes,0.2
2901,ทิโปมินิโรลเค้กรสนม,chocolate,0.2
2902,ดูเร็กซ์เฟเธอร์ไลท์,condoms and lubricants,0.2
2903,ยาน้ำแก้ไอมะขามป้อมยูอีคอฟ,100% juice,0.2
2904,มาม่าบิ๊กแพ็คต้มยำกุ้ง,instant noodles,1.0
2905,โคไซตี้ลิปบาล์มวอเทอร์เมลอน,liquid soap,0.2
2906,MBLลิปแมทเดอะครีมมี่,,0.0
2907,สุทธิลักษณ์แหนมแท่งพร้อมทาน,chilled local deli,0.4
2908,ดอกบัวคู่แชมพูมะกรูด,shampoo,0.4
2909,ซอลยังยาทาเล็บสีกลิตเตอร์แดง(),energy and sports drinks,0.2
2910,คลอเร็ทออริจินอล,hard candies,0.4
2911,วีทครีมขจัดขนอโลเวร่า&วิตามินอี,shaving and hair remover,0.6
2912,เฮอร์ชีเอ็กซ์ตร้ามิ้ลค์ช็อก,chocolate,0.2
2913,SpaCleanฆ่าเชื้อไฮจีนิคซอฟท์,floor cleaners,0.4
2914,คอสมีเซียเอสเซนส์วิตามินซี,body lotion,0.6
2915,ดีโด้น้ำส้มผสมวิตามินซี,hard candies,0.2
2916,มอนด์ซับมาส์กแบล็ค,instant coffee,0.2
2917,โอเอซิสเนเชอรัลสวีทฟลอรัล&พิงค์โรส,deodorants and body scent,0.2
2918,ลิสเตอรีนน้ำยาบ้วนปากคูลมินต์,mouthwash,1.0
2919,พอนด์สเบิสทครีมไวท์บิวตี้,facial moisturizer,0.6
2920,แบร์ดี้อมยิ้มยูนิคอร์น,gummy and jelly,0.2
2921,พานาโซนิคถ่านจิ๋วLR,batteries,1.0
2922,ลิปตันแบล็คทีเลมอน,tea leaves,0.4
2923,ตรางูแป้งเย็นรีแล็กซิ่ง,talcum powder,0.8
2924,ยางรัดผมเส้นเล็ก(ถุง),rubber gloves,0.4
2925,ปากกากดลูกลื่นสีน้ำเงิน.,stationery,0.4
2926,เจนโซลาร์ถ่านคาร์บอนซิงค์AAAx,aerosol air fresheners,0.2
2927,รวงข้าวสุราขาว,flour,0.2
2928,นกพิราบผักกาดดองยำเกียมฉ่าย,canned vegetables,1.0
2929,พัฟแป้งฝุ่นใหญ่(),corn chips and popcorn,0.4
2930,โซฟีลอง&ไวด์แผ่นอนามัยไม่มีน้ำหอม,panty liners,1.0
2931,ซอฟเฟลสเปรย์กันยุงกลิ่นฟลอรัล,insect repellent,1.0
2932,ฮอลล์ลูกอมน้ำผึ้งผสมเลมอน,hard candies,1.0
2933,หมอนอิงตุ๊กตารูปสัตว์,pasta and spaghetti,0.4
2934,นาดิน,talcum powder,0.2
2935,ห่านคู่เสื้อคอกลมสีดำไซส์L,fresh eggs,0.2
2936,โอบิวซ์บลัชออน,tofu ,0.2
2937,ไอโซมิลพลัสเอไอคิวพลัสสูตร,1 plus,0.6
2938,สก๊อตซุปไก่สูตร,essence of chicken,1.0
2939,กล่องใส่เครื่องสำอาง,cotton and accessories,0.2
2940,วาสลีนเจลเฟรชยูทฟูล,body lotion,0.8
2941,ไฮคลาสปรับผ้าสีฟ้า,fabric softener,1.0
2942,ยาน้ำกษัยเส้นม้าปลาคู่สูตรกระชายดำ,seafood snacks,0.4
2943,ชุดสังฆทานถุงทองมงคล,monk gift baskets,1.0
2944,ไม้ปิงปองแพ็คคู่พร้อมลูก,crackers,0.6
2945,มิสทีนอายบราว().,eyes and brows,1.0
2946,ลอรีอัลรีไวท์ทัลลิฟท์ไมโครเอสเซนส์,facial mask,0.6
2947,UNOหัวชาร์จพร้อมสายLightning,fruit snacks,0.6
2948,ฮอลล์ฟรุตตี้สอดไส้เฟรชไลม์ซอง,hard candies,0.4
2949,เคเอยูวีเพอร์เฟคซันล็อคSPF,hard cheese,0.2
2950,มาสคาร่าเอ็กซ์คิวมีซูพรีมวอลลุ่ม,eyes and brows,0.8
2951,รองเท้าแตะแบบสวมคละแบบ,day sanitary napkin,0.4
2952,เซอร์เทนตี้สบายแพนส์จัมโบ้L,adult diapers pant,0.8
2953,ไลฟ์ฟอร์ดปารีสเมจิคพาวเดอร์,concentrated drinks,0.6
2954,A-Homeสกรูหัวห่วงตัวซี,canned vegetables,0.2
2955,ที่วางมือถือแบบตั้ง(),coffee creamers,0.2
2956,อาทเจ็ทเทอร์ไมท์ปลวกรุ่นหัวเจ็ท,insecticide sprays,0.6
2957,ฮานาโซลลิปบาล์มเจลลี่เบอร์รี่,liquid soap,0.2
2958,USBHub(),,0.0
2959,สตาร์เวลล์กาแฟผสมโกจิเบอร์รี่,flavored yogurt,0.4
2960,วิสทร้าแพลนท์อมิโปรพลัสวิตามินบี,functional drinks,0.6
2961,ยางปั้มสุขภัณฑ์,scrub brushes and toilet scrubbers,0.6
2962,โพรเทคส์แป้งฟลอรัลพิงค์,talcum powder,0.2
2963,คิงส์สเตลล่าคาเคาเฟรชเจลชาวเวอ,glass cleaners,0.2
2964,อาทเจ็ทบลูลาเวนเดอร์,insecticide sprays,0.4
2965,เรนเจอร์ยาจุดควันน้อยลาเวนเดอร์,insecticide coils,0.8
2966,เบบี้มายด์อาบสระสปาร์คกลิ้งซันเดย์,liquid soap,1.0
2967,โอริโอคุกกี้รสดับเบิ้ลสตั้ฟ.,biscuit and cookies,1.0
2968,NATURถุงเก็บน้ำนมแม่,breast milk storage bag,0.2
2969,AppleMonkeyสตรอเบอร์รี่กล้วย,infant cereal,0.2
2970,ดร.สมชายเจลอโลเวล่า,facial cleanser,0.2
2971,ชุดเย็บกระดาษ(L),apples and pears,0.8
2972,เมอร์เรซกาเอ็กเซลเลนท์ฟาวเดชั่นไลท์เบจ,shaving and hair remover,0.2
2973,บิโอเรUVบอดี้อินเทนซีฟไวท์เซรั่ม,sunscreen,0.2
2974,แพลนเต้เฟิร์มมิ่งเอ็กซ์ตร้าไวท์โลชั่น,body lotion,1.0
2975,การ์นิเย่โลชั่นซากุระ,body lotion,0.4
2976,แอมบิเพอร์เจลลาเวนเดอร์+,car air fresheners,0.2
2977,การ์นิเย่วิปโฟมซากุระไวท์พิงคิช,facial cleanser,0.6
2978,โซคิวอโลเวร่าซูทติ้งเจล,body lotion,0.2
2979,เพดดิกรีสุนัขพันธ์เล็กเดนต้าสติ๊ก,pet snacks and treats,1.0
2980,PolyBriteแปรงขัดโถสุขภัณฑ์ฟ้า,scrub brushes and toilet scrubbers,0.6
2981,น่ารักเบบี้โลชั่นคาโมมายล์,tea bag,0.6
2982,นูโทรจีนาไมเซล่าวอเตอร์ดีพคลีน,makeup remover,0.4
2983,ซิสเท็มมาแปรงสีฟันซุปเปอร์ซอฟx,toothbrush,1.0
2984,สปาคลีนดันฝุ่นถูพื้นคูลลิ่งเฟรช,floor cleaners,0.6
2985,เชนการ์ดแชมพูสุนัขสีส้ม,pet accessories and toys,0.2
2986,คลีน&เคลียร์โฟมดีพแอคชั่น,facial cleanser,0.4
2987,ซิลกี้แฮร์โคทวิตามินอีซิลกี้,hair conditioner,0.2
2988,ฮานาโซลลิปทรีทเม้นท์สตรอว์เบอร์รี่.,olive oil,0.8
2989,โซฟีกระชับแม็กซี่ปีก,day sanitary napkin,0.8
2990,สติ๊กเกอร์แบบนูนคละสี,stationery,0.2
2991,คลอเร็ทแอ็คติซอลพลัสคูลมินต์,hard candies,0.4
2992,เพียวรีนเซนซิทีฟไวพ์,toothpaste,0.6
2993,มิสทีนมาสคาร่าโมเดลมิราเคิลแลช.,eyes and brows,0.2
2994,โดฟครีมนวดสีฟ้า,hair conditioner,1.0
2995,เอบอนเน่สครับมาสก์ไวท์เทนนิ่ง.,facial mask,0.4
2996,A-Homeประแจหกเหลี่ยม/ชุด,disposable tableware,0.2
2997,ไฟน์ไลน์เข้มข้นออร์แกนิคเขียว.,liquid detergent,0.6
2998,เนสกาแฟB&Bสูตรไม่มีน้ำตาลทราย.,instant coffee mixes,0.4
2999,เบอริน่าครีมสีผมดำ(A),shampoo,0.2
