,name,product_cat_lv3,conf
4366,สิวันนาอายแชโดว์,eyes and brows,0.8
4367,เฟอร์เชย์เค้กโรลใบเตยครีม,cakes and pies,0.2
4368,ลิปไอซ์เมจิคคัลเลอร์สตรอเบอร์รี่,gummy and jelly,0.2
4369,Ambipurดับกลิ่นบนเนื้อผ้าDowny,spray starch,0.2
4370,A-Homeถุงมือช่าง,rubber gloves,0.8
4371,บีเง็นผงย้อมสีผมดำ,hair coloring,0.6
4372,แชมป์ล้างห้องน้ำเข้มข้นสีชมพู,bathroom cleaners,0.8
4373,ลอรีอัลวิปโฟมไวท์เพอร์เฟค,facial cleanser,0.8
4374,นามิเซรั่มบิวตี้ซีเครทไวท์,facial mask,0.2
4375,มอร์นิ่งคิสสีทาเล็บเจลAB.,body lotion,0.2
4376,ทาโรโรลเข้มข้น,seafood snacks,1.0
4377,ยาฟูแป้งรองพื้นทูเวย์เค้ก,foundation and facial powder,1.0
4378,ไลฟ์รี่กางเกงซึมซับL,adult diapers pant,1.0
4379,ฟันเดย์ยางรัดแฟนซี.,rubber gloves,0.2
4380,ซังซังนมถั่งเหลืองยูเอชที,japanese and korean deli,0.2
4381,มังกรคู่ก๋วยเตี๋ยวเซี่ยงไฮ้,noodles,0.4
4382,สก๊อตเพียวเร่เบอรี่,nutrition drinks,0.6
4383,ดีนี่สบู่เหลวซากุระ,liquid soap,1.0
4384,ซีพีไข่เค็มแช่เย็นแพ็ค,frozen meals,0.8
4385,PigeonจุกนมซิลิโคนL,insect repellent,0.2
4386,ว้าวน้ำยาล้างจานกลิ่นเกรฟฟรุต,dish detergent,0.8
4387,วิตามินซีไวต้าซี(ส้ม)ซอง,hard candies,0.2
4388,วิสกัสลูกแมวพ็อกเก็ตส์รสปลาทู,cat dry food,0.8
4389,โอเลย์รีเจนเนอรีสยูวีครีม,facial moisturizer,1.0
4390,เทปOPP,stationery,1.0
4391,มาจิคลีนถูพื้นวนิลาโรส,floor cleaners,1.0
4392,เซปเป้บิวตี้เจลลี่ไฟเบอร์,functional drinks,0.4
4393,ซีแม็กปลาย่างอบกรอบรสต้มยำหม้อไฟ,instant noodles,0.8
4394,ยาอมสมุนไพรมังกรทอง(บ๊วย),insecticide coils,0.2
4395,แพรอทอาบน้ำเขียว,bar soap,0.8
4396,ผ้าขนหนูเช็ดตัว,ham and bacon,0.2
4397,ไลฟฟอร์ดอายโบรว์สลิมดาร์กช็อคโกแลต.,muesli and granola,0.2
4398,คอลบาเด้นท์ยาสีฟัน,toothpaste,1.0
4399,ฮอลล์คูลเมนโทลิปตัล,hard candies,0.2
4400,M&Gปากกาเจลลบได้สีน้ำเงิน.,stationery,0.4
4401,เบบี้เลิฟเพลย์แพ้นท์นาโนL,baby diapers pants,1.0
4402,ยกนิ้วซอสพริก,seasoning and dipping sauce,0.2
4403,ฉัตรอรุณข้าวหอมผสม(/),jasmine rice,0.6
4404,ไฟน์ไลน์น้ำยาซักผ้าซันนี่พิงค์,liquid detergent,0.6
4405,การ์นิเย่ซากุระไวท์ครีมSPF,body lotion,0.2
4406,เบบี้มายด์แป้งอัลตร้ามายด์เพียว,talcum powder,0.6
4407,โซฟีหลับสนิทตลอดคืนแบบกางเกงM,night sanitary napkin,1.0
4408,PopStarsถุงมือยางอเนกประสงค์คละไซส์X,rubber gloves,0.8
4409,สปาคลีนถูพื้นลักชูรี่,floor cleaners,0.6
4410,สิวันนาคัลเลอร์ส์บลัชเชอร์.,hard candies,0.4
4411,ไวไวควิกคัพหมูสับต้มยำ,instant noodles,1.0
4412,ปทุมมาศครีมขัดหน้า,coffee creamers,0.4
4413,กระเรียนทองข้าวหอมมะลิสุรินทร์,jasmine rice,0.6
4414,เคที่ดอลล์แอลกลูต้าอาบูตินพีลลิ่งเจล,liquid soap,0.2
4415,ไฮคิวซอสพริกศรีราชา,chili sauce,0.8
4416,ดีแคชซูพรีมสีผมบลอนด์สว่าง(M),hair coloring,0.6
4417,น้ำยาล้างสีเจล&สีทั่วไปมิกซ์เบอรี่,toothpaste,0.4
4418,เบสท์ฟู้ดส์แยมส้ม,jams and marmalade,1.0
4419,ใยขัดแฟนซีคละแบบ,scouring pads,0.8
4420,คาร์โปร์ล้างรถฟลอรัล,car care,0.4
4421,พลาสเตอร์ผ้าไทเกอร์พลาสซอง,medicine,0.4
4422,คอมฟอร์ทอัลตร้าปรับผ้าน้ำเดียวชมพู,fabric softener,1.0
4423,โอบิวซ์ลิปไอซ์เบบี้ส้ม,orange and pomelo,0.2
4424,นูโทรจีน่าสครับโฟมดีพคลีนแบล็คเฮด,facial cleanser,0.8
4425,ศรีจันทร์แป้งอัดแข็งทรานลูเซนท์.,foundation and facial powder,0.8
4426,ปาร์ตี้คริสปี้พายรสคอร์นชีส,ice cream,0.2
4427,ฮอลล์ชูทเตอร์น้ำผึ้งเลมอนซอง,hard candies,0.8
4428,ฟลูโอคารีลยาสีฟันไวท์เทนนิ่ง,toothpaste,0.8
4429,เกลือแร่นีโอไลต์(ส้ม),vitamins and supplements,0.2
4430,เซ็ทรถตักทรายDC,kitchen utensils,0.2
4431,Zilkopfแฮร์เซรั่ม,hair treatment,0.4
4432,สปาคลีนถูพื้นลิลลี่ซีเครท,floor cleaners,0.6
4433,อีซี่ไบร์ทชุดคุ้มจับคู่(C),scouring pads,0.4
4434,นาทริฟแป้งรองพื้นบีบี&ซีซีวิตามิน(C),foundation and facial powder,0.2
4435,การ์นิเย่โฟมไลท์คอมพลีท,facial cleanser,0.8
4436,บูเต้แป้งรองพื้นไวท์ซีแอนด์อีUVโปร,foundation and facial powder,0.8
4437,ผ้าคาดผมFluffy,fabric softener,0.6
4438,การ์นิเย่มาส์กแบลคเซรั่มชาร์โคลพิงค์,facial mask,0.8
4439,นามิโซลชิคลิปแอนด์แมตWildRose,prawn chips,0.2
4440,นีเวียUVออยล์คอนโทรลเซรั่มSPF,facial cleanser,0.2
4441,ฟลูโอคารีลยาสีฟันออร์โธ,toothbrush,0.4
4442,โลแลนพิคเซลครีมยืดผมเข้มข้น,hair treatment,0.4
4443,บาร์บี้อมยิ้มไดมอนด์ริง,nuts and seed snacks,0.8
4444,เมลินดาอายไลเนอร์ดินสอ.,eyes and brows,0.8
4445,ภูเขาทองซอสปรุงรสฝาเขียว,seasoning and dipping sauce,0.6
4446,ไวไวเส้นหมี่หมูสับ,instant vermicelli,0.4
4447,เวปวันพุชสเปรย์กันยุงซากุระ,insect repellent,0.8
4448,โรจูคิสไฮยาพอร์เลสมาส์ก,facial mask,0.2
4449,กวางเจาลูกชิ้นปลารักบี้,meat balls and surimi,0.8
4450,แสนดีข้าวขาวหอมมะลิ(ถิ่นสยาม),jasmine rice,0.8
4451,เอ็กซ์คิวท์มีแป้งทูเวย์XY,foundation and facial powder,0.8
4452,เบบี้เลิฟประหยัดNB,baby diapers tape,0.6
4453,นามิลิปโซลเกิลครีมมี่แมทฮันนี่พีช(),coffee creamers,0.2
4454,เบสท์โคเรียเซรั่มแอนไทเมลาสม่า,facial moisturizer,0.8
4455,รื่นรมย์เจลล้างมือ,first aid and bandages,0.4
4456,H&Sแชมพูชาร์โคล,toothbrush,0.4
4457,"ชาเม่คริสตัลคอลลาเจน,",vitamins and supplements,0.4
4458,ชิมดูแกงมัสมั่นไก่พร้อมทาน,instant meals,0.8
4459,โมนาริเกลือกระปุกกลิ่นมะขาม,japanese seasonings,0.6
4460,นีเวียไมเซล่าวอเตอร์แอคเน่แคร์,makeup remover,0.8
4461,ฮอลล์คูลเมนโทลิบตัสแบบแท่ง,hard candies,0.4
4462,พัฟเกลี่ยรองพื้นคละแบบ,makeup accessories,0.2
4463,คลีน&เคลียร์เจลล้างหน้า,facial cleanser,0.6
4464,แอนลีนมอฟแม็กซ์UHTรสงาดำ,plain uht milk,0.4
4465,ไฟน์ไลน์เข้มข้นปรับผ้าสีแดง,fabric softener,0.2
4466,แปรงล้างหน้า(),scrub brushes and toilet scrubbers,0.6
4467,D-PLUSเค้กรสสตรอเบอร์รี่,cakes,0.2
4468,พาเพลินเวเฟอร์โรลรสช็อกโกแลต,wafers,0.8
4469,โลแลนพิกเซลครีมช็อกโกแลตเข้ม(P),hair coloring,0.6
4470,มิตรผลน้ำเชื่อมถุง,palm and specialty sugar,0.2
4471,นีเวียเมนมัดโฟมเอ็กตร้าไวท์,facial cleanser,1.0
4472,เป๊ปซีแมกซ์กระป๋อง,cola,0.6
4473,น้องพรน้ำจิ้มซีฟู้ด,japanese and korean deli,0.4
4474,มินิทเมดสแปลชรสส้ม,mixed juice,0.8
4475,ตลับคอนแทคเลนส์,butter and margarine,0.2
4476,วิคตอรี่เแปรงสีฟันเรียวม่า,flavored uht milk,0.2
4477,ตราหมีโกลด์นมไขมันต่ำผสมชาขาว,flavored uht milk,0.6
4478,คลีเน็กซ์ซอฟแพ็ค,facial tissue,0.8
4479,ชีววิถีเซรั่มบำรุงหนังศรีษะมะกรูด,hair treatment,0.6
4480,ยาทาแก้ปวดหยางกวงครีม,medicine,0.4
4481,นิน่าทิชชู่,facial tissue,0.4
4482,ฮันนี่วีบีเอสซียูวีลิปแคร์FO,facial cleanser,0.2
4483,สก๊อตซุปไก่สกัดผสมถั่งเฉ้า,essence of chicken,0.8
4484,โอเล่สตรอเบอร์รี่,deodorants and body scent,0.2
4485,ไบโอชิคครีมสีผมบลอนด์เขียว(C-)Box,hair coloring,0.8
4486,สมูทอีครีมไวท์เบบี้เฟส,facial cleanser,0.8
4487,กรรไกรตัดเล็บ,nail care accessories,0.2
4488,ซีแอนด์ซีน้ำยาล้างคอนแทคเลนส์,car care,0.4
4489,วิกซอลออกซี่ห้องน้ำสีฟ้า,bathroom cleaners,1.0
4490,ดีนี่ปรับผ้าสีม่วง,baby fabric softener,0.6
4491,ซอลยังบลัชออนคอรัลส้มพีช(),bathroom cleaners,0.2
4492,มิว-นิคสกินเรซิพีคอลลาเจนมาสก์.,facial mask,0.2
4493,ฟิชเชอร์แมนชูการ์ฟรีช็อกโกเมนโทมินต์,hard candies,1.0
4494,ลิลัคคุมะจุกหลอกขอบนุ่ม,facial moisturizer,0.2
4495,แอคเน่เอดลิควิดคลีนเซอร์,facial cleanser,0.8
4496,ไวตามิ้ลค์บาร์เลย์มอลต์,uht dairy free,1.0
4497,บิสชินเวเฟอร์รสโกโก้,wafers,0.8
4498,ปิ่นเงินข้าวเสาไห้,jasmine rice,0.4
4499,KAโลชั่นทานาคาไวเทนนิ่ง,mouthwash,0.2
4500,อาทยาจุดกันยุงแบบขดมะกรูด,insecticide coils,0.8
4501,ดีแคชครีมสีผมบลอนด์สว่าง(H),hair coloring,0.8
4502,การ์นิเย่ซากุระไวท์สลีปปิ้งมาส์ก,facial mask,0.6
4503,โซฟีถนอมผิวสลิมปีก,day sanitary napkin,0.6
4504,เกษตรคัพวุ้นเส้นยำทะเล,noodles,0.2
4505,โพรเทคส์อาบน้ำพรอสโพลิส,liquid soap,0.8
4506,เบบี้เลิฟพรีเมี่ยมโกลด์แพ้นท์L,baby diapers pants,0.8
4507,เซนต์บิวตี้ทรีทเมนท์มะพร้าว,body lotion,0.2
4508,บอนแบคซุปไก่สกัด,essence of chicken,1.0
4509,อัพทูยูแฮร์เจลซุปเปอร์ฮาร์ดฟ้า,hair styling,0.8
4510,แอมบิเพอร์สเปรย์บลูโอเชี่ยน,aerosol air fresheners,0.8
4511,สเนลไวท์UVซีซีครีม,liquid soap,0.2
4512,มินมินลูกอมกลิ่นจูซี่พลัม,hard candies,0.4
4513,คิงส์สเตลล่าเฟรชชี่แบร์บับเบิ้ล,soap dish detergent,0.2
4514,เดนทีนรุ่นมัลติแพควอเตอร์เมลอน,flavored soft drinks,0.2
4515,วิตามินซีไวต้า-ซี(องุ่น)ซอง,pasta and spaghetti,0.4
4516,สมูทโตะเซรั่มโทเมโทคอลลาเจนไวท์,facial moisturizer,0.4
4517,เซนต์เซรั่มโกลด์เฟเชียล,facial moisturizer,0.8
4518,เซอร์เทนตี้ซุปเปอร์แพ้นส์XL,adult diapers pant,1.0
4519,ลิสเตอรีนน้ำยาบ้วนปากกรีนที,mouthwash,1.0
4520,ชีนเน่แป้งรองพื้นออยฟรีทูโกC,foundation and facial powder,1.0
4521,โอบิวซ์ลิปไอซ์เบบี้สตอเบอร์รี่,flavored yogurt,0.2
4522,เซนส์&ซอฟท์ผ้าอ้อมผู้ใหญ่เทปL,adult diapers tape,0.6
4523,ทิปโก้น้ำผักโปรไฟเบอร์แอปเปิล,100% juice,1.0
4524,โบย่าคิวเท็นโลชั่นวิตามินซีเฟิร์มมิ่ง,body lotion,0.4
4525,เดอมอลมาส์กพรีเมี่ยมโกล์ด,instant coffee,0.2
4526,โออิชิกรีนทีรสแอปเปิ้ลฮันนี่,ready to drink tea,1.0
4527,VS_ดินสอกดHB..รวมคละลาย,stationery,0.6
4528,หมอนผ้าห่มคละสี,stationery,0.6
4529,ฮานาโซลลิปทรีทเม้นท์ออริจินอล,facial mask,0.2
4530,ดินน้ำมัน,stationery,0.2
4531,ยิลเลตต์ซุปเปอร์ธินใบมีดรุ่น+,shaving and hair remover,1.0
4532,ชุดช้อนส้อม,kitchen utensils,0.2
4533,VS_ดินสอไม้HBP./คละลาย,stationery,1.0
4534,เคที่ดอลล์โกลว์เจลทินน์()ชูการ์พีช.,sunscreen,0.2
4535,แวนิชเพาเวอร์โอทูสีชมพู,bleach and stain remover,1.0
4536,สโนว์ผ้าเย็นชนิดผ้าสำลีขนาด..,liquid detergent,0.2
4537,ซีโร่ถุงขยะดำขนาด*,condoms and lubricants,0.2
4538,หงส์ขาว(ห่าน)แป้งข้าวสาลี,flour,0.4
4539,รวมรสน้ำปลาพริก(),fish sauce,1.0
4540,สิวันนาแป้งตลับเนเชอร์รัลบิวตี้,toothpaste,0.2
4541,เมจิกทวินบัตดตอร์,rice crackers and flour chips,0.4
4542,โปรวาเมดโฟมเซนซิทีฟ,acne medication,0.2
4543,เนสกาแฟเอสเพรสโซ,instant coffee,0.6
4544,เปาวินวอชลิควิดสีแดง,liquid detergent,1.0
4545,โอบิวซ์บีบีพิงค์เมจิกสีเนื้อกลาง,toothbrush,0.2
4546,ซิสเท็มมายาสีฟันเชอร์รี่,toothbrush,1.0
4547,ว้าวล้างจานอนามัย,machine dishwashing detergent,0.2
4548,โรจูคิสเพอร์เฟคพอร์เลสมาสก์.,facial mask,0.4
4549,CINTAKUสบู่น้ำนมข้าว,bar soap,0.2
4550,อาทเจ็ทโกลด์,insecticide sprays,0.6
4551,โซฟีคูลลิ่งเฟรชสลิมปีก,night sanitary napkin,0.4
4552,บีไนซ์อาบน้ำขาวอมชมพู,liquid soap,1.0
4553,ไวตามิ้ลค์ออริจินัลพลัส,uht dairy free,0.6
4554,ยาดมเซียงเพียวอิ๊ว,inhalant and balms,0.4
4555,ไฟน์ไลน์น้ำยาซักผ้าสวีทฟลอรัล,liquid detergent,0.4
4556,ตรางูแป้งรีแล็กซิ่ง,talcum powder,0.8
4557,หอยหลอดน้ำปลาขวดเพท(ฝาเขียว),fish sauce,1.0
4558,เพดดิกรีเพาซ์เนื้อไก่น้ำเกรวี่,dog wet food,1.0
4559,มาลีน้ำทับทิมผสมผลไม้รวม,100% juice,1.0
4560,โซฟีคูลลิ่งเนเชอรัลไนท์.,night sanitary napkin,0.4
4561,เรนองทีรสชาเขียวญี่ปุ่น.,herbal tea,0.8
4562,สิวันนาลิปสติกเนื้อแมตคิสมี(),dog dry food,0.2
4563,กูนน์แพ้นท์SJBXXXL,baby diapers pants,1.0
4564,ฉัตรข้าวหอมมะลิใหม่,jasmine rice,0.8
4565,เกษตรเต้าหู้ไข่ไก่,tofu ,1.0
4566,กิเลนคู่เส้นเล็กอบแห้ง,noodles,0.6
4567,อบาคัสรสช็อกโกแลต,festive chocolates,0.6
4568,บีไนซ์อาบน้ำเเดง,liquid soap,0.8
4569,ฮอลล์ฟรุตตี้สอดไส้เฟรชไลม์,hard candies,0.4
4570,ภูเขาทองซอสพริกเผ็ดน้อย,chili sauce,0.6
4571,สมูทอีครีมโกลด์,facial moisturizer,0.2
4572,เอิร์ทสเปรย์ทำความสะอาดแอร์,car care,0.2
4573,ปีโป้กัมมี่คละรส,gummy and jelly,0.8
4574,โอเลย์เนเจอรัลไวท์Allin.,facial moisturizer,0.6
4575,ฮานาโซลโลชั่นพีช&ฮันนี่,honey and syrup,0.4
4576,โคไซตี้มาส์กทานาคา&วิตามินซีเฟเชี่ยล,fruit snacks,0.6
4577,ยางรัดผมโดนัทโบว์ยาวลายจุด(),rubber gloves,0.2
4578,เบสท์โอเดอร์วัตถุแต่งกลิ่นวานิลลา.,baking ingredients,0.4
4579,โดนัทท์คอลลาเจนเชอร์รี่,facial moisturizer,0.4
4580,ฮาดะลาโบะเพอร์เฟคเจล,facial moisturizer,0.6
4581,ถุงเท้าซ่อนข้อหญิง,chilled local deli,0.2
4582,ไม้บรรทัดยาว,rubber gloves,0.2
4583,หนองโพนมสดรสช็อกโกแลต,flavored milk,0.2
4584,ซันสแนครสต้นตำรับ,nuts and seed snacks,0.2
4585,ตรามือเมล็ดฟักทองกะเทาะเปลือก,nuts and seed snacks,0.4
4586,TGMสโมคราวน์แฮม,crackers,0.6
4587,เนสกาแฟเรดคัพเอสเปรสโซMRC-ARC,instant coffee,0.6
4588,แว็กซี่ผ้าไมโครไฟเบอร์x,car care,0.6
4589,รอยัลบิวตี้เซรั่มซิก้ากรีนทีคอลลาเจน,facial moisturizer,0.4
4590,พนาทิพย์สบู่ขมิ้นน้ำผึ้ง,drinking water,0.4
4591,เอนฟาโกรเอพลัส,1 plus,0.6
4592,นีเวียโลชั่นมิลค์SPF,body lotion,0.8
4593,เลย์คลาสสิครสโนริสาหร่าย,potato chips,0.8
4594,ฟริทซีพลัสรสโคล่า,hard candies,0.4
4595,ยูสตาร์มาจอรี่คอนซีลเลอร์()วานิลลา,floor cleaners,0.2
4596,สบู่สมุนไพรพฤกษา,acne medication,0.2
4597,ดิออริจินัลมาส์คชาร์โคลดีฟสตริบส์,acne medication,0.2
4598,ชาวเกาะวุ้นมะพร้าว,coconut oil,0.2
4599,โอชาผงชูรส,msg bouillon cube and powder,0.8
4600,ยาสมุนไพรฟ้าทะลายโจรแหลมทองการแพทย์,insecticide coils,0.2
4601,รอยัลบิวตี้ซุปเปอร์ซีซีครีมSPF,foundation and facial powder,0.4
4602,โอเล่สเปรย์ทำความสะอาดมือ,deodorants and body scent,0.2
4603,เมนโทลาทั่มโฟมแอคเน่ไวท์,facial cleanser,0.6
4604,จัสท์โมเดอร์นทรีทเมนท์สาหร่าย,hair treatment,0.2
4605,เคที่ดอลล์มาส์กชีทแฮปปี้อโลเวร่า,hair conditioner,0.2
4606,ไดเรคเตอร์ทอยแรบบิทมิลล์.,rice crackers and flour chips,0.2
4607,เบทาโกรไข่ไก่แม่ไก่สาวแพ็ค,fresh eggs,0.4
4608,มาม่าเส้นหมี่น้ำใส,instant vermicelli,0.6
4609,ยางรัดผมโดนัทคละแบบ(),rubber gloves,0.2
4610,โอเล่แคทแมวโตรสแซลมอน,cat dry food,0.2
4611,บิโอเรโฟมเพียวออยล์เคลียร์,facial cleanser,0.6
4612,จับใจชาจับเลี้ยง,ready to drink tea,0.2
4613,ดับเบิ้ลมินต์หมากฝรั่งเปปแผง.,chewing gum,0.8
4614,ตราหมีUHTสูตร,kids uht milk,0.6
4615,แคร์คิดแชมพูเชอร์รี่,hard candies,0.2
4616,NATURชุดปั๊มนมแบบโยก,plain uht milk,0.2
4617,กระเป๋าดินสอ,surprise bag,0.6
4618,ฟิตเน่สมุนไพร,herbal tea,0.4
4619,บอนโอบอนช็อกโกแลต,chocolate,0.2
4620,แม่ประนอมน้ำจิ้มไก่,seasoning and dipping sauce,0.4
4621,วิภาดาสบู่กลูต้าวิตามินอี,bar soap,1.0
4622,คิดส์มาเนียแก๊สปั้มลูกอมผลไม้,soft candies,0.2
4623,หน้ากากอนามัยกันฝุ่นเด็ก,mask,0.8
4624,คิงส์สเตลล่าก้อนดับกลิ่นลาเวนเดอร์,aerosol air fresheners,0.2
4625,ฮาร์ทบีทจัมโบสตรอเบอรีลิ้นจี่,fruit snacks,0.2
4626,เบงเบงใส้ครีมไวน์ช๊อกมะพร้าว,coffee creamers,0.4
4627,สเมอร์นอฟมิดไนท์แม็กซ์,european bread,0.6
4628,แกรนด์รังนกสูตรคอลลาเจนกลิ่นกุหลาบ,vitamins and supplements,0.2
4629,โรสเซล่าไข่ไดโนเสาร์.,instant soup,0.2
4630,ซันตาน่าน้ำลิ้นจีผสมวุ้นมะพร้าว,flavored yogurt,0.2
4631,ชีนเน่แป้งรองพื้นออยฟรีรีฟิวC,mops,0.2
4632,มิสทีนโลชั่นพริตตี้บลูมเพอร์ฟูม,eyes and brows,0.4
4633,บิโอเรแผ่นแปะสิวเสี้ยนพอร์แบล็ค,acne medication,0.6
