,name,product_cat_lv3,conf
1366,ยาลดไข้ซีมอล,smoked meat,0.2
1367,ยกนิ้วแป้งข้าวเหนียว.,flour,0.6
1368,จอห์นสันเบดไทม์เบบี้ออยล์,body lotion,1.0
1369,พีจอยคุกกี้แอนด์ครีม,biscuit sticks,0.4
1370,นามิเอเอออร่าซอง,spaghetti sauce,0.2
1371,บอดี้เชฟอีซี่ดีท็อกซ์ทรอปิคอลซันไรซ์,liquid soap,0.2
1372,จอห์นสันเบบี้ออยล์อโรวิตามินอี,body lotion,0.8
1373,คลีเน็กซ์บียูกล่อง,facial tissue,0.8
1374,ซีแม็กซ์ปลาย่างอบกรอบรสต้นตำรับ,rice crackers and flour chips,0.2
1375,อาทโนแมทพลัส,insecticide electric,0.6
1376,ดีแคชทรีทเม้นท์วิตามินเพอร์เฟคติ้ง,facial moisturizer,0.8
1377,แพลนเต้เกิร์ลลี่เอ็กซ์ตร้าไวท์โลชั่น,body lotion,1.0
1378,คนแบกกุ้งน้ำปลาขวดเพท,fish sauce,0.4
1379,Lancerปากกาลูกลื่นสไปรัล,stationery,0.2
1380,เจนโซลาร์ถ่านคาร์บอนซิงค์AAx,aerosol air fresheners,0.2
1381,เรนเจอร์ยาจุดควันน้อยออสแมนตัส,insecticide coils,0.4
1382,กระเป๋าเศษสตางค์(),hair coloring,0.2
1383,ตะไคร้น้ำปลาหวาน(สูตรดั้งเดิม)สีแดง,fruit dipping,0.4
1384,เพดดิกรีสุนัขพันธุ์ใหญ่เนื้อรมควัน,pet snacks and treats,0.8
1385,เบย์บีช้อนปลายนุ่มฟ้าชมพู,fabric softener,1.0
1386,เหรียญทองคู่แป้งกล้วยทอด,bread crumbs and crispy flour,0.2
1387,เจลลดไข้(เด็ก)บายบายฟีเวอร์,chili sauce,0.2
1388,เคลียร์แชมพูสีม่วง,shampoo,1.0
1389,เบย์บีชามพร้อมช้อนและไม้บด,jasmine rice,0.2
1390,ดิ๊พโซ่ซีเคร็ทแฮร์เซรั่ม,hair treatment,0.2
1391,ชีววิถีแชมพูมะกรูด,shampoo,0.6
1392,กู๊ดไรฟ์น้ำปลาสูตรลดโซเดียม,fish sauce,0.2
1393,ยูสตาร์มาจอรี่อายชิมเมอร์มูส()โกเด้น,chocolate,0.2
1394,MC--A(BGR),chocolate,0.4
1395,เดลี่เฟรชชี่ปรับอากาศส้ม,continuous air fresheners,0.8
1396,โก๋แก่ถั่วลิสงเคลือบอบโนริวาซาบิ,nuts and seed snacks,1.0
1397,ซอฟท์ดีปรับผ้าสีม่วง,fabric softener,0.8
1398,เนสกาแฟลาเต้,ready to drink coffee,0.4
1399,สปาคลีนล้างมือซากุระ,car care,0.4
1400,บีไนซ์จุดซ่อนเร้นฟ้า,feminine wash,0.6
1401,ดัชมิลค์ซีเล็คเต็ดUHTรสจืด,flavored uht milk,0.2
1402,นีเวียโฟมไวท์ออยเคลียฟิลเลอร์,facial cleanser,0.8
1403,จอยโลชั่นเอ็กตร้าไวท์อาร์บูติน,body lotion,0.6
1404,WaxOneไทร์โฟม.,car care,0.2
1405,สมุดริมด้ายAKK,chilled local deli,0.4
1406,โสมอิน-ซัมพลัสเห็ดหลินจือ,essence of chicken,0.2
1407,เบเกอร์รี่เฮาส์สอดไส้แยมสับปะรด,biscuit and cookies,0.2
1408,สโนว์เกิร์ลบูสเตอร์อโลแอนด์สเนล,body lotion,0.2
1409,MC--A(VI),shampoo,0.2
1410,เบสท์ฟู้ดส์แยมสตอเบอรี่,jams and marmalade,1.0
1411,แคร์บิวแชมพู+ครีมนวดมะกรูด,hair conditioner,0.8
1412,ทีพอทExtra,condensed milk,0.8
1413,ไอลีนลิปแคร์เชอร์รี่,lip care,0.4
1414,BSCแป้งตลับฮันนี่วีสวีทแบร์W,facial cleanser,0.2
1415,สนิกเกอร์ส,chocolate,0.4
1416,สลินเฮิร์บสบู่สมุนไพรมะขามแท้,bar soap,0.6
1417,MBLมาสคาร่าวอลุ่มเอ็กเพรสไฮเปอสีดำ,eyes and brows,0.8
1418,บีไนซ์จุดซ่อนเร้นชมพูใส,feminine wash,0.6
1419,ดีนี่ซักผ้าเด็กชมพูถุง,baby detergent,1.0
1420,ยาอมมายบาซินซิงค์(ส้ม),vitamins and supplements,0.2
1421,เคลียร์แชมพูผู้ชายสีดำ,shampoo,1.0
1422,มอคโคน่าทรีโอริชแอนด์สมูท,instant coffee mixes,1.0
1423,ดีแคชซูพรีมสีผมน้ำตาลเข้ม(M),hair coloring,0.8
1424,ทีพอทExครีมเทียมพร่องไขมันสำหรับอาหาร,condensed milk,0.4
1425,มรกตน้ำมันรำข้าว,rice bran oil,0.4
1426,จอห์นสันเบดไทม์เบบี้โลชั่น,body lotion,1.0
1427,โลแลนพิกเซลครีมน้ำตาลอ่อนทอง(P),hair coloring,1.0
1428,โรจูคิสเซรั่มกลูต้าพอร์เลส,bar soap,0.2
1429,ดูเม็กซ์ดูแลคอีซี่แคร์สูตร,ice cream,0.4
1430,เนสต์รังนกผสมคอลลาเจน,dairy free milk,0.4
1431,มาวินผลิตภัณฑ์เสริมอาหารชาย,vitamins and supplements,1.0
1432,เกาลูนวุ้นเส้นสด,fresh noodle,0.8
1433,เบอร์นี่ลิปสติก-ออเร้นจ์เชอร์เบท.,nutrition drinks,0.2
1434,คอฟฟี่เมตไขมันต่ำ,coffee creamers,1.0
1435,ยาทาแก้ปวดเคาน์เตอร์เพนเอชอาร์ครีม,medicine,0.2
1436,กนกชัยธูปกำกลิ่นกฤษณา,fresh noodle,0.4
1437,ดาร์ลิ้งวุ้นคาราจีแนนรสลิ้นจี่,gummy and jelly,1.0
1438,แอ๊กซ์สเปรย์อพอลโล,deodorants and body scent,0.8
1439,มามี่โพโคแพ้นท์ญXXL,baby diapers pants,1.0
1440,โคโดโมเฮดทูโทคิดส์ฟ้า,baby bottle detergent,0.2
1441,ฟาเกอร์ครีมสีผมบลอนด์แดง(/),hair coloring,0.8
1442,มอร์นิ่งคิสสีทาเล็บเจลA.,body lotion,0.2
1443,ดอยคำน้ำมะเขือเทศม็อคเทล,100% juice,0.6
1444,แบรนด์รังนกแท้Rejuniplexคลาสสิค,bird's nest,1.0
1445,นิสชินคัพพรีเมี่ยมบะหมี่ไก่เผ็ดเกาหลี,instant noodles,0.8
1446,โบตันเม็ดอมสมุนไพรกลิ่นชะเอมมิ้นท์,hard candies,1.0
1447,วันทัชแฮปปี้,baby food,0.6
1448,สปายไวน์คูลเลอร์เรด,spa treatment,0.4
1449,P&Lกรวยกรองน้ำ,drinking water,0.4
1450,สปาร์คเคิลยาสีฟันทริปเปิ้ลไวท์,toothpaste,0.8
1451,เลย์เพลย์ทรีดีรสบาร์บีคิว,potato chips,0.6
1452,เนสกาแฟB&Bเอสเปรสโซ่โรสต์,ready to drink coffee,0.2
1453,เทปใส/,hair conditioner,0.2
1454,โคอาล่าเดอะแบร์กลิ่นเชอร์รี่บลอสซัม,ice cream,0.2
1455,ฮอลล์ลูกอมมิกซ์เบอร์รี่แผง.,hard candies,1.0
1456,จุฬาเฮิร์บวอเตอร์เมลอนอีอีคูชั่น,liquid soap,0.2
1457,ชีววิถีสบู่สปาสูตรนมข้าว,floor cleaners,0.2
1458,ถุงเท้าขาวเทา,flour,0.4
1459,บิโอเรUVอะควาริชมูสSPF,facial sunscreen,0.8
1460,Eleganceฝักบัวชำระ แฮปปี้,olive oil,0.2
1461,โออิชิกรีนทีส้มวุ้นมะพร้าวพลัสซี,ready to drink tea,1.0
1462,อะยัมปลาแมคคาเรลในซอสมะเขือเทศ,canned fish,1.0
1463,ดิวเบอร์รี่พัฟเค้กครีมบลูเบอร์รี่,biscuit and cookies,0.2
1464,ฟิชเชอแมนเฟรนชูการ์ฟรีแบล็คเคอแรนท์,hard candies,1.0
1465,ชาร์ปี้ปากกามาร์เกอร์ชนิดถาวรสีดำ,peanut butter,0.2
1466,คลีเน็กซ์ดิสนีย์พ็อคเก็ต,facial tissue,0.8
1467,Hocoสายชาร์จ(),facial moisturizer,0.2
1468,นีเวียดีโอสเปรย์เอ็กซ์ตร้า,deodorants and body scent,1.0
1469,เจลลดไข้(ทารก)คูลฟีเวอร์,continuous air fresheners,0.8
1470,วอยซ์แครกเกอร์ไส้ครีมบัตเตอร์,crackers,0.6
1471,สมูทอีแอคเน่ไฮโดรเจล,makeup remover,0.2
1472,A-Homeท่อย่นอเนกประสงค์.,drain openers,0.8
1473,นีเวียเมนสรับโฟมไวท์ออยล์เคลียร์,facial cleanser,0.8
1474,พานาโซนิคหลอดไฟEFUHV,lighting,0.4
1475,บิวตี้สรินพลัสดีทอซี่คอฟฟี่,coffee creamers,0.8
1476,สเมอร์นอฟอิเล็คทริคเรด,european bread,0.4
1477,เบบี้มายด์ออยล์อัลตร้ามายด์อโร,body lotion,0.8
1478,หลินจือพลัสชิตาเกะ,oyster sauce,0.2
1479,แกรนด์รังนกสูตรคอลลาเจนกลิ่นลิ้นจี่,vitamins and supplements,0.2
1480,สายฝนบุหรี่,cooking vinegar,0.6
1481,เนสกาแฟ,instant coffee,0.6
1482,รองเท้าเด็กเล็กคละแบบ,dried soup ingredients,0.6
1483,ดอร์โก้มีดโกนสีเหลืองรุ่น,100% juice,0.6
1484,ของเล่นแมวคละแบบ,kid's toys,0.4
1485,สมูทอีแอคเน่ไฮโดรเจลพลัส,makeup remover,0.2
1486,เนเจอร์กิฟกาแฟผสมโสมสกัด,instant coffee mixes,0.4
1487,โรซี่แครกเกอร์อิมพีเรียล,crackers,1.0
1488,ฮานาโซลครีมอินสแตนท์ไบร์ทเฟส,prawn chips,0.4
1489,วอยซ์รสครีมมี่บัตเตอร์,wafers,0.2
1490,วีทแว็กซ์เชียร์บัตเตอร์,drinking yogurt,0.2
1491,นาทริฟแป้งรองพื้นบีบี&ซีซีเอ็ตร้า,foundation and facial powder,0.8
1492,ซิตร้าพิงค์กิชเอสเซนส์,body lotion,1.0
1493,ซอลส์ยาสีฟันเฟรชแจเปนนิส,toothpaste,0.8
1494,เบบี้มายด์แป้งซากุระ,talcum powder,0.2
1495,ฮานาโซลไมเซล่าออยล์อินฟิวส์,makeup remover,0.4
1496,โอเลย์ครีมโททัลแอนตี้เอจจิ้งSPF,facial moisturizer,0.8
1497,เจอร์กี้ทรีทส์สติ๊กเนื้อตับ,pet snacks and treats,1.0
1498,ยาน้ำบรรเทาปวดเมื่อยกำลังหนุมาน,medicine,0.6
1499,MC--A(GE),preserved vegetables,0.4
1500,เอลเซ่รสวานิลลา,ice cream,0.2
1501,จอห์นสันอาบน้ำท็อปทูโทวอช,liquid soap,0.6
1502,เอ็กซ์คิวท์มีแป้งทูเวย์XR,foundation and facial powder,0.8
1503,เพียวริคุองุ่นเคียวโฮ,ready to drink tea,1.0
1504,โซฟีคูลลิ่งเฟรชเนเชอรัลไนท์ปีก,night sanitary napkin,0.6
1505,แพนทีนครีมนวดแฮร์ฟอลคอนโทล,hair conditioner,1.0
1506,โซฟีคอมฟอร์ทเฟรชบางรีแลกซ์อะโรมา,panty liners,0.8
1507,เนสวีต้าข้าวโพดผสมข้าวพอง,soy and cereal beverages,1.0
1508,วาสลีนโลชั่นเฮลธี้ไวท์SPF++ ,body lotion,1.0
1509,โอบิวซ์ทินท์กลมสีส้ม(),biscuit and cookies,0.2
1510,แชมป์น้ำยาถูพื้นกลิ่นฟลอรัล,floor cleaners,1.0
1511,ฟาเกอร์ครีมสีผมบลอนด์ทอง(/),hair coloring,0.8
1512,นาทริฟBBพิงค์ไดมอนด์พาวเดอร์,foundation and facial powder,0.4
1513,ตราหมีโอเมก้าUHTรสน้ำผึ้ง,kids uht milk,0.6
1514,ซีเล็คน้ำพริกผัดทูน่า,canned fish,1.0
1515,ซอลยังดินสอเขียนคิ้ว+กบเหลาน้ำตาลแดง,eyes and brows,0.6
1516,แคริสม่าโดราเอมอนทิชชู่เปียก,facial blotters and wipes,0.4
1517,MC--A(LB),baby diapers tape,0.8
1518,ไดมินยาแก้เมารถเมาเรือ,nuts and seed snacks,0.4
1519,แอ๊กซ์สเปรย์ช็อคโกแลต,cocoa powder,0.4
1520,นามิอายแชโดว์โซลเกิลครีมมี่ช็อกโก้(),coffee creamers,0.2
1521,เฮลซ์บลูบอยกลิ่นสละ,concentrated drinks,0.2
1522,ภูมิพฤกษาแชมพูเปลี่ยนสีผมน้ำตาลดำ,hair coloring,0.8
1523,ไทยซอสเซสไส้กรอกรมควัน(มินิ)*,sausages,0.2
1524,มามี่โพโคแฮปปี้แพ้นท์เดย์&ไนท์S,baby diapers pants,1.0
1525,แบรนด์รังนกแท้สูตรคลาสสิค,bird's nest,1.0
1526,คลีนชูส์แปรงขัดรองเท้า,heel care accessories,0.4
1527,ลีฟเนสกาแฟผสมถั่งเช่าเห็ดหลินจือ,nutrition drinks,0.4
1528,นีเวียโรลออนฮอกไกโดโรส,deodorants and body scent,1.0
1529,โคโคโรเวเฟอร์กรอบสอดไส้ครีมช็อค,toothpaste,0.6
1530,โอโม่มาตรฐาน,powder detergent,0.6
1531,โอโมพลัสลิควิดเพอร์ฟูม,powder detergent,0.4
1532,ไฟท์ขจัดคราบถุง,bleach and stain remover,1.0
1533,ไวไวเส้นหมี่อบแห้ง,noodles,0.6
1534,โคคอนโยโก้บาร์รวมรส,gummy and jelly,0.8
1535,เด็กสมบูรณ์เต้าเจี้ยวสูตร,soy sauce,0.8
1536,ฮกแดงแป้งหมี่ถุง,flour,0.4
1537,เกษตรวุ้นเส้น,noodles,0.2
1538,อาทโนแมทพลัส+รีฟีล(ไร้สาย),insecticide electric,0.2
1539,ดร.สมชายโฟมแอคเน่ซาลิไซลิก,facial cleanser,0.6
1540,ที่เจาะกระดาษ,toilet tissue,0.2
1541,ษฎาน้ำตาลอ้อยธรรมชาติ,palm and specialty sugar,0.8
1542,ชาเม่คอลลาเจนไตรเปปไทด์พลัส,vitamins and supplements,0.4
1543,ไฟน์ไลน์ปรับผ้าแฮปปี้เนส(ทอง),laundry,0.4
1544,H&Sแชมพูสมูทแอนด์ซิลกี้,shampoo,0.6
1545,เกลดเจลเลมอน,continuous air fresheners,0.8
1546,เภสัชสกินไลท์,facial moisturizer,0.2
1547,ใยขัดตัว,body care accessories,0.6
1548,คาราบาวแดงเครื่องดื่มชูกำลัง,energy and sports drinks,0.4
1549,เฮลซ์บลูบอยกลิ่นครีมโซดา,concentrated drinks,0.2
1550,เหรียญทองแป้งจ้าวแดง,flour,0.8
1551,กุมิกุมิรสเมลอนญี่ปุ่น,fresh noodle,0.2
1552,เคลียร์แชมชายสีดำ,preserved vegetables,0.2
1553,มรกตน้ำมันปาล์มขวด,palm oil,0.6
1554,ดีแคชมาสเตอร์แมสสีผมน้ำตาลกลางMB,toothbrush,0.2
1555,ยูสตาร์สเปรย์น้ำแร่เฟเชียล,facial moisturizer,0.2
1556,เท็นเท็นยาทาเล็บสีเบจ(TTA),nail care,0.2
1557,การ์นิเย่เมนออยคอนโทรล,facial cleanser,0.6
1558,แม่มะลิเต้าทึงรวมมิตรในน้ำลำไย,canned fruit,0.8
1559,ซูกัสลูกอมรสราสเบอรี่,soft candies,0.6
1560,แบรนด์เด็กรสช็อคโกลาวา,cocoa powder,0.4
1561,ตะวันแดงสุราข้าวหอม,white rice,0.2
1562,เบบี้มายด์แป้งสวีทแอลมอนด์,body lotion,0.6
1563,ฉลามผสมกระชายดำ,soy and cereal beverages,0.2
1564,ช็อกโกแลตรูปเต่าทอง,seafood snacks,0.6
1565,โรลเลอร์โคสเตอร์ทินชิลลี่ฮอตบอมบ์,potato chips,0.8
1566,การ์นิเย่ซากุระไวท์เดย์UV,body lotion,0.2
1567,ชีนเน่แป้งฝุ่นบีบีออยส์ฟรีจูเนียร์,sausages,0.4
1568,ดัชมิลล์ดีไลท์,drinking yogurt,0.8
1569,เบสท์ฟูดส์มักกะโรนีเส้นยาว,frozen meals,0.4
1570,ดินสอสีไม้,stationery,0.8
1571,อัคราไข่ไก่สดเบอร์,fresh eggs,0.8
1572,วีดิทท์มาส์กโคลนไข่มุก,facial mask,0.4
1573,ยาแก้ท้องอืดอีโน(ส้ม)ซอง.,medicine,0.4
1574,โดนัทท์คอลลาเจนส้ม,facial moisturizer,0.6
1575,โพรเทคส์อาบน้ำไอซ์ซี่คูล,bar soap,0.4
1576,ง่วนเชียงปรุงรสฝาเขียว,soy sauce,0.8
1577,โรลเลอร์แผ่นเรียบสไปซี่บาร์บีคิว,potato chips,0.4
1578,ชิลด์ท็อกซ์แนท,insecticide sprays,0.6
1579,PolyBriteแผ่นใยขัดพื้นด้ามจับเขียว,scouring pads,0.4
1580,แกสบี้แว็กซ์แดง,hair styling,0.4
1581,ตราหมีเบบี,flavored uht milk,0.2
1582,ฟลูโอคารีลแปรงสีฟันชุดเดินทาง,toothbrush,0.2
1583,โคโดโมแป้งฟ้า,talcum powder,0.8
1584,อลาวรี่เนยแท้ชนิดเค็ม,butter,0.4
1585,รอยัลบิวตี้เซรั่มคอลลาเจน+วิตามินซี,facial moisturizer,0.8
1586,ไทยเดนมาร์คนมพาสเจอร์ไรซ์รสกาแฟ,flavored milk,0.2
1587,แปรงบรูมหัวพลาสติกใหญ่,sweet snacks,0.4
1588,หงษ์ทิพย์ข้าวหอม,jasmine rice,0.4
1589,โฟร์โมสต์นมสดช็อกโกแลต,flavored milk,0.4
1590,ยกนิ้วน้ำจิ้มไก่,corn chips and popcorn,0.2
1591,เอ็กซ์คิวท์มีเอ็กซ์ตร้าดาเมจลีฟอินครีม,shampoo,0.6
1592,แอทแทค,liquid detergent,0.4
1593,อาเจบิ๊กโคล่า,shampoo,0.2
1594,ปุ้มปุ้ยแมคเคอเรลซอสมะเขือเทศเข้มข้น,instant meals,0.6
1595,แม่ครัวฉลากทองซอสหอย,oyster sauce,0.6
1596,คอนเน่รสชีส,corn chips and popcorn,0.4
1597,ไทยเดนมาร์คUHTรสจืด,kids uht milk,0.2
1598,ไลท์ชูการ์น้ำตาล,artificial sweeteners,0.2
1599,ชิลด์ท็อกซ์เหลืองยุง,flour,0.2
1600,ปาร์ตี้คาราเมล,rice crackers and flour chips,0.6
1601,ดีนี่ซักผ้าเด็กนิวบอร์น,baby detergent,0.2
1602,คลีน&เคลียร์แอคเน่คลีนเซอร์,facial toner,0.2
1603,ดีแคชมาสเตอร์แมสสีผมบลอนด์ทองH,hair coloring,0.8
1604,เดนทิสเต้ยาสีฟันเอ็กซ์คูทีฟ+,toothpaste,0.8
1605,ลอรีเอะซูเปอร์Ultraสลิม,night sanitary napkin,0.4
1606,การ์นิเย่ซากุระเรเดียนซ์SPF,facial cleanser,0.4
1607,โฟร์โมสต์UHTรสช็อคโกแลต,flavored uht milk,0.4
1608,กลูต้าแมกซ์,bathroom cleaners,0.2
1609,ไทยเดนมาร์คโยเกิร์ตรสธรรมชาติ,plain yogurt,0.2
1610,การ์นิเย่โฟมซากุระไวท์พิงคิช,facial cleanser,0.6
1611,เอ็กซ์คิวท์มีอายบราวเพ็นซิลนามอน,eyes and brows,0.8
1612,กิเลนคู่วุ้นเส้น,noodles,0.4
1613,มาดามเฮงสบู่แอคเน่เคลียร์,bar soap,0.6
1614,หงษ์ทองข้าวหอมมะลิใหม่ต้นฤดู,jasmine rice,0.6
1615,UFCเต้าเจี้ยว,soy sauce,0.6
1616,แอนลีนรสจืด,plain uht milk,0.4
1617,TODDYขวดนมสลิม,feeding accessories,0.2
1618,โคคอนมินิพุดดิ้งรวมรส,gummy and jelly,0.6
1619,ทอปเบอโรนมิลค์,chocolate,0.6
1620,ฟ้าไทยซุปผงรสหมู+ชาม,msg bouillon cube and powder,0.8
1621,พอนด์สมิสพาวเดอร์ชมพู,talcum powder,0.6
1622,ครูเซ็ทน้ำยาย้อมสีผมน้ำตาลเข้ม,hair coloring,0.6
1623,โซฟีแผ่นอนามัยคูลลิ่งเฟรชกลิ่นหอม,panty liners,0.6
1624,เรนเจอร์สเก้าท์-,dental care,0.6
1625,มิสทินโอดีดีลิปแคร์.,deodorants and body scent,0.6
1626,โรจูคิสเพอร์เฟคพอร์เลสไฮโดรเจลมาส์ก,acne medication,0.2
1627,ยูนิฟเฟรชผักผลไม้รวมใบเขียว,100% juice,1.0
1628,ธรรมข้าวกล้องหอมมะลิคัดพิเศษ,,0.0
1629,เลย์ร็อคเอ็กซ์ตร้าบาร์บีคิว,potato chips,0.2
1630,ดีโด้น้ำองุ่น,100% juice,0.4
1631,วิเศษนิยมยาสีฟันชนิดผง,toothpaste,0.6
1632,มินิทเมดรสส้มแมนดาริน,mixed juice,0.6
1633,ฮอลล์ชูทเตอร์น้ำผึ้งเลมอน,hard candies,0.8
1634,โคโดโมชุดของขวัญตะกร้าSet,baby bottle detergent,0.2
1635,เพดดิกรีกระป๋องรสเนื้อวัว,dog dry food,0.6
1636,โพลี-ไบรท์ฟองน้ำหุ้มตาข่ายคละสี,scouring pads,0.2
1637,ยาใส่แผลเพียวริดีน,insecticide coils,0.2
1638,เอสเซ้นส์ซักผ้าสีชมพู,liquid detergent,0.6
1639,แชมป์ผงซักฟอก,processed seafood,0.2
