,name,product_cat_lv3,conf
0,ดาวน์นี่ปรับผ้าดอกไม้อันแสนสดชื่น,fabric softener,1.0
1,แพนทีนแชมพูแฮร์ฟอล+ครีมนวดทรีมินิท,shampoo,1.0
2,ครัวนภัสน้ำจิ้มสุกี้ย่างเกาหลีรสเผ็ด,seasoning and dipping sauce,1.0
3,ไมโลผงแอคทีฟโก,instant chocolate and malt powder,1.0
4,ชาวเกาะกะทิUHT,coconut milk,1.0
5,มาจิคลีนถูพื้นลิลลี่บูเก้,floor cleaners,1.0
6,ไฮยีนบลีชซักผ้าชมพู,bleach and stain remover,1.0
7,วาสลีนสบู่เฮลตี้ไวท์,body lotion,1.0
8,ยำยำจัมโบ้หมูสับ,instant noodles,1.0
9,พานาโซนิคถ่านอัลคาไลน์LR/,batteries,1.0
10,วิกซอลออกซี่ห้องน้ำสีชมพู,bathroom cleaners,1.0
11,บีทาเก้นพร่องมันเนย(ขวด),drinking yogurt,1.0
12,อิชิตันออร์แกนิคน้ำผึงมะนาว,ready to drink tea,1.0
13,ดาวน์นี่ซักผ้าลิควิคการ์เด้นบลูมถุง,liquid detergent,1.0
14,แอทแทคอีซี่เซ็กซี่สวีท,powder detergent,1.0
15,คอลเกตยาสีฟันเฮอร์เบิ้ลซอลท์,toothpaste,1.0
16,คาร์เนชั่นครีมเทียมข้นหวาน,condensed milk,1.0
17,เป๊ปซี่แมกซ์ราสเบอร์รี่ขวด,cola,1.0
18,ไนซ์อาบน้ำขาวอมชมพูถุง,liquid soap,1.0
19,บีไนซ์อาบน้ำเขียว,liquid soap,1.0
20,ดีนี่ซักผ้าเด็กฟ้าถุง,baby detergent,1.0
21,สมาร์ทเข้มข้นปรับผ้าHappyFresh,fabric softener,1.0
22,บีไนซ์อาบน้ำแอนตี้แบคทีเรียม่วง,liquid soap,1.0
23,ยิลเลตต์โฟมโกนหนวดกลิ่นเมนทอล,shaving and hair remover,1.0
24,ทองการ์เด้นถั่วปากอ้ารสผัดขี้เมา,nuts and seed snacks,1.0
25,โค้ก.,cola,1.0
26,H&Sแชมพูคูลเมนทอล,shampoo,1.0
27,โก๋แก่ถั่วลิสงอบกรอบรสกะทิ,nuts and seed snacks,1.0
28,ไฮยีนรีดเรียบสีชมพูถุง,spray starch,1.0
29,คอลเกตยาสีฟันโปรเฟสชั่นแนลคลีนเจล,toothpaste,1.0
30,ไฮยีนเอ็กซ์เพิร์ทแคร์ปรับผ้าสีดำ,fabric softener,1.0
31,โชกุฯอาบน้ำผิวนุ่มสีชมพู,liquid soap,1.0
32,แพนทีนแชมพูแฮร์ฟอลคอนโทรล,shampoo,1.0
33,วิสกัสเพาซ์จูเนียร์ปลาทูน่า,cat wet food,1.0
34,เปาวินวอชลิควิดสีโอโรส,liquid detergent,1.0
35,นิสชินไก่เผ็ดเกาหลี,instant noodles,1.0
36,โฟร์โมสต์โอเมก้าโกลด์UHTรสจืด,kids uht milk,1.0
37,นีเวียโลชั่นไวท์เรเดียน,body lotion,1.0
38,ดาวน์นี่ปรับผ้าสวีทฮาร์ท,fabric softener,1.0
39,ดัชชี่โยเกิร์ตธรรมชาติ,flavored yogurt,1.0
40,อิงอรสบู่ไพลหอม,bar soap,1.0
41,จอห์นสันบลอสซั่มแป้ง,talcum powder,1.0
42,ศศิแป้งรองพื้น(W).,foundation and facial powder,1.0
43,ไฟน์ไลน์ซักผ้าเข้มข้นโปรคลีน.ชมพู,liquid detergent,1.0
44,สไปร์ทสูตรไม่มีน้ำตาล,flavored soft drinks,1.0
45,ลอตเต้ฟูเซนโนมิโคล่าเลมอน,biscuit and cookies,1.0
46,ซิสเท็มมาแปรงสีฟันนุ่มมาตรฐานx,toothbrush,1.0
47,ซีโร่ถุงขยะแบบหนา,garbage bags,1.0
48,รถพยาบาลสำลีก้อนชนิดเติม,cotton and accessories,1.0
49,แลคตาซอยโกลด์ซีรีย์มัทฉะ,uht dairy free,1.0
50,บิงโกแชมพูปิดผมขาวสีน้ำตาลเข้ม(.),hair coloring,1.0
51,จอห์นสันซัมเมอร์บลูมส์แป้ง,talcum powder,1.0
52,สมาร์ทฮาร์ทสุนัขโตตับรมควัน.,dog dry food,1.0
53,เรโซนาโรลออนไวท์เทนนิ่งเฟรชโรส,deodorants and body scent,1.0
54,เพดดิกรีสุนัขโตตับและผัก,dog dry food,1.0
55,ดูโอแคร์สำลีแผ่นรีดขอบ,cotton and accessories,1.0
56,ไฟน์ไลน์เนเชอรัลปรับผ้าสีม่วง,fabric softener,1.0
57,คอมฟอร์ทปรับผ้าสีม่วง,fabric softener,1.0
58,ธูปหอมสั้น,candles and incense,1.0
59,เด็กสมบูรณ์น้ำจิ้มบ๊วย,seasoning and dipping sauce,1.0
60,แบรนด์ซุปไก่สกัดผสมโสม,essence of chicken,1.0
61,เอสเซ้นส์รีดเรียบสีชมพูหัวฉีด,spray starch,1.0
62,ธูปหอมศรัทธาธรรมธูป,candles and incense,1.0
63,นีเวียดีโอโรลออนพาวเดอร์ทัช,deodorants and body scent,1.0
64,มาจิคลีนถูพื้นสวีทโรส,floor cleaners,1.0
65,แบร์ดี้ลูกอมกลิ่นโคล่า,hard candies,1.0
66,ยำยำจัมโบ้ต้มยำกุ้ง,instant noodles,1.0
67,เซ็นโซดายน์ยาสีฟันโทเทิลแคร์,toothpaste,1.0
68,ออรัลบีแปรงสีฟันอัลตร้าธินกัมแคร์ซอฟท์,toothbrush,1.0
69,คาร์เนชั่น,condensed milk,1.0
70,ไฮยีนเอ็กซ์เพิร์ทปรับผ้าอควา,fabric softener,1.0
71,ไฟน์ไลน์ซักผ้าเข้มข้นดีลักซ์.ดำ,liquid detergent,1.0
72,โก๋แก่ถั่วลิสงเคลือบอบรสไก่,nuts and seed snacks,1.0
73,แพนทีนครีมนวดโทเทิลดาเมจแคร์,hair conditioner,1.0
74,ไลปอนเอฟล้างจานเจแปนนีสพีช,dish detergent,1.0
75,โค้กซีโร่,cola,1.0
76,คาร์เนชั่นพลัสนมข้นหวานหลอดบีบ,condensed milk,1.0
77,แบรนด์รังนกแท้สูตรน้ำตาลน้อย,bird's nest,1.0
78,ฟาเกอร์ครีมสีผมบลอนด์อ่อนสว่าง(/),hair coloring,1.0
79,อิงอรสบู่ส้มมะละกอ,bar soap,1.0
80,มาม่าต้มยำกุ้ง,instant noodles,1.0
81,ยกนิ้วพริกไทยดำป่น,"salt, pepper and chilli powder",1.0
82,ไลฟ์รี่กางเกงซึมซับXL,adult diapers pant,1.0
83,ไฮคลาสปรับผ้าสีชมพู,fabric softener,1.0
84,โออิชิน้ำผึ้งมะนาวดับเบิ้ลเลม่อน,ready to drink tea,1.0
85,แพนทีนครีมนวดแฮร์ฟอล,hair conditioner,1.0
86,เดนทีนไอซ์เชอรี่,chewing gum,1.0
87,เอเวอร์กรีนสำลีมินิ,cotton and accessories,1.0
88,เซนกะวิปโฟมเพอร์เฟ็ค,facial cleanser,1.0
89,ยูปี้เยลลี่โกลวอร์ม,gummy and jelly,1.0
90,ทองการ์เด้นฟิสตาชิโออบเกลือ,nuts and seed snacks,1.0
91,HEROฟิล์มยืดถนอมอาหาร,food wraps,1.0
92,ดาวน์นี่ปรับผ้านุ่มมิสทีค,fabric softener,1.0
93,คอมฟอร์ทเนเชอรัลปรับผ้าสีชมพู,fabric softener,1.0
94,ทรอสเจลแต่งผมเอ็กตร้าโฮลด์,deodorants and body scent,1.0
95,สมาร์ทฮาร์ทเพาซ์อาหารสุนัขโตรสแซลมอน,dog dry food,1.0
96,ยกนิ้วน้ำส้มสายชูเทียม,cooking vinegar,1.0
97,ไส้ตันน้ำปลา,fish sauce,1.0
98,มอนดามินน้ำยาบ้วนปากคาวาอี้มิกฟรุต,mouthwash,1.0
99,คอลเกตยาสีฟันริ้วใส,toothpaste,1.0
100,โคโดโมยาสีฟันเจลบับเบิ้ลฟรุ๊ต,toothpaste,1.0
101,เด็กสมบูรณ์ซีอิ้วขาวเห็ดหอม,soy sauce,1.0
102,ยกนิ้วน้ำปลาผสม,fish sauce,1.0
103,โลแลนแชมพูปิดผมขาวสีน้ำตาลเข้ม(S),hair coloring,1.0
104,คอมฟอร์ทอัลตร้าปรับผ้าสีชมพู,fabric softener,1.0
105,ปลาหมึกน้ำปลาแท้ขวดเพ็ทฉลากเหลือง,fish sauce,1.0
106,แพนทีนครีมนวดคัลเลอร์เฟิร์ม,hair conditioner,1.0
107,ฟิชเชอร์แมนเฟรนด์ชูการ์ฟรีซิตรัส,hard candies,1.0
108,รีจอยส์มอยส์เจอร์สมูทแชมพู,shampoo,1.0
109,อิงอรสบู่มะขาม,bar soap,1.0
110,แลคตาซอยสูตรเจ,uht dairy free,1.0
111,มาลีเงาะในน้ำเชื่อม,canned fruit,1.0
112,ทาโร่ซุปเปอร์แซบ,seafood snacks,1.0
113,ฮอทต้าขิงผงรสเข้มข้น,herbal tea,1.0
114,ทาโร่รสเข้มข้น,seafood snacks,1.0
115,เลย์คลาสสิครสไข่เค็ม,potato chips,1.0
116,ยัมยัมบิสกิตแท่งครีมช็อกโกแลต,biscuit and cookies,1.0
117,คาราบาวกาแฟโรบัสต้า,ready to drink coffee,1.0
118,ไร่ทิพย์ถั่วเขียวเลาะเปลือก,dried beans nuts and seeds,1.0
119,ดูเร็กซ์เพอร์ฟอร์มา,condoms and lubricants,1.0
120,ไฮนซ์ซอสมะเขือ,ketchup and tomato paste,1.0
121,เวอเธอร์ออริจินอลลูกอมรสครีมคาราเมล,hard candies,1.0
122,เซนกะวิปโฟมแอคเน่แคร์,facial cleanser,1.0
123,ดร.สมชายแอคเน่โลชั่น,facial cleanser,1.0
124,แบรนด์ซุปไก่สกัดผสมถั่งเฉ้า,essence of chicken,1.0
125,เนลี่รสสาหร่ายซอสญี่ปุ่น,seasoned seaweed,1.0
126,แลคตาซอยรสหวาน,uht dairy free,1.0
127,เคลียร์แชมพูน้ำตาล,shampoo,1.0
128,นีเวียโลชั่นไวท์เฟิร์มแอนด์สมูท,body lotion,1.0
129,เดอลิเซ่ครีมเปลี่ยนสีผิวสูตรขมิ้นชัน,hair coloring,1.0
130,รีจอยส์พาร์ฟูมสมูทแชมพู,shampoo,1.0
131,โก๋แก่ถั่วฝักรสเค็ม,nuts and seed snacks,1.0
132,ดินสอ,stationery,1.0
133,ก้านต่างหู(),cotton and accessories,1.0
134,แบรนด์เห็ดสกัดเข้มข้น,essence of chicken,1.0
135,อิมพีเรียลเวเฟอร์สอดไส้ครีมรสนม,wafers,1.0
136,ม็อบฟองน้ำ,mops,1.0
137,ซิตร้าโลชั่นไบรท์ไวท์ออร่าเจลชมพู,body lotion,1.0
138,ซันไลต์เลมอนเทอร์โบ,dish detergent,1.0
139,เดนทิสเต้ยาสีฟันพลัสไวท์,toothpaste,1.0
140,โมเดสแม๊กซี่คอตตอนนี่ไม่มีปีก,olive oil,1.0
141,เด็กสมบูรณ์ซีอิ้วขาวสูตร,soy sauce,1.0
142,เต่าเหยียบโลกซากุระ,deodorants and body scent,1.0
143,กูลิโกะป๊อกกี้ช็อกโกแลต,biscuit sticks,1.0
144,คอมฟอร์ทอัลตร้าเขียว,fabric softener,1.0
145,รีจอยส์แชมพู,shampoo,1.0
146,ซันซิลแชมพูสีชมพู,shampoo,1.0
147,เป๊ปซีกระป๋อง,cola,1.0
148,เด็กสมบูรณ์ซีอิ้วดำสูตร,soy sauce,1.0
149,คอลเกตยาสีฟันเฟรชมิ้นท์,toothpaste,1.0
150,พานาโซนิคถ่านดำใหญ่R,batteries,1.0
151,เบบี้เลิฟเทปNB+,baby diapers tape,1.0
152,ซันไลต์ล้างจานเลมอน,dish detergent,1.0
153,ง่วนเชียงซีอิ้วขาวเห็ดหอม,soy sauce,1.0
154,แอ๊กซ์สเปรย์แบล็ค,deodorants and body scent,1.0
155,อาทพลัสยาจุดกันยุงแบบขดลาเวนเดอร์,insecticide coils,1.0
156,โคอะล่ามาร์ชบิสกิตสอดไส้ช็อกโก.,biscuit and cookies,1.0
157,โชกุฯอาบน้ำผิวขาวสีเขียว,liquid soap,1.0
158,โซฟีลอง&ไวด์หนาระบายอากาศ,panty liners,1.0
159,ดาร์ลี่ยาสีฟันดับเบิ้ลแอคชั่น,toothpaste,1.0
160,ซีเล็คฟิตต์ทูน่าแซนวิชในน้ำแร่,canned fish,1.0
161,"เจเล่บิวตี้ผสมวิตามินA,C,E",fresh vegetables,1.0
162,คอมฟอร์ทปรับผ้าสีฟ้า,fabric softener,1.0
163,ยิลเลตต์ใบมีดเวคเตอร์x,shaving and hair remover,1.0
164,บีทาเก้นพร่องมันเนย,drinking yogurt,1.0
165,หอยนางรมน้ำปลาแท้ฉลากทอง,fish sauce,1.0
166,เบนโตะปลาหมึกเส้นรสซีอิ๊วญี่ปุ่น,seafood snacks,1.0
167,ดีนี่ออร์แกนิคสบู่เหลวอาบสระ,liquid soap,1.0
168,ไวตามิ้ลค์ดับเบิ้ลแบล็ค,uht dairy free,1.0
169,เบนเนทสบู่วิตามินอีสีส้ม,bar soap,1.0
170,ซิตร้าโลชั่นไข่มุกเข้มข้น,body lotion,1.0
171,คอลเกตยาสีฟันยอดนิยม,toothpaste,1.0
172,แลคตาซอยหวานคลาสสิค,uht dairy free,1.0
173,เบสท์โคเรียเซรั่มแพลงตอนคอลลาเจน,facial moisturizer,1.0
174,แบรนด์รังนกแท้ผสมโสมสูตรไม่มีน้ำตาล,bird's nest,1.0
175,มงกุฏทะเลปลาแมคเคอเรลในซอสมะเขือเทศ,canned fish,1.0
176,โอเลย์ครีมรีเจนเนอริสไมโครสคัลป์ติ้ง,facial moisturizer,1.0
177,สมาร์ทฮาร์ทสุนัขเล็กเนื้ออบ.,dog dry food,1.0
178,ฟิชเชอร์แมนเฟรนด์สไปซี่แมนดาริน,hard candies,1.0
179,ทองการ์เด้นถั่วลิสงอบเกลือ,nuts and seed snacks,1.0
180,สมาร์ทซักผ้าเข้มข้น,liquid detergent,1.0
181,เถ้าแก่น้อยสาหร่ายย่างบิ๊กโรลคลาสสิค,seasoned seaweed,1.0
182,โออิชิชาเขียวน้ำผึ้งมะนาว,ready to drink tea,1.0
183,พานาโซนิคถ่านจิ๋วดำR,batteries,1.0
184,โฟร์โมสต์โอเมก้าUHTรสจืด,kids uht milk,1.0
185,นกพิราบคู่เงาะในน้ำเชื่อม,canned fruit,1.0
186,แพนแพนมันฝรั่งแผ่นรสซาวครีมหัวหอม,potato chips,1.0
187,แลคตาซอยรสช็อกโกแลต,uht dairy free,1.0
188,ลิสเตอรีนน้ำยาบ้วนปากโทเทิลแคร์,mouthwash,1.0
189,ไวตามิ้ลค์ทูโกดับเบิ้ลแบล็ค,uht dairy free,1.0
190,พีชชี่ฟักทองนมข้าวโพดมันฝรั่ง,baby food,1.0
191,ง่วนเชียงซีอิ้วหวาน,soy sauce,1.0
192,ฮอลล์เอ็กซ์เอสมินต์กลิ่นสตรอแบบกล่อง,hard candies,1.0
193,ไลฟ์ฟอร์ดอายไลเนอร์สีดำ.,eyes and brows,1.0
194,บีไนซ์อาบน้ำมีซทีคไวท์ชมพูเข้มถุง,liquid soap,1.0
195,โซซอฟท์กระดาษม้วนเดี่ยวยาว,toilet tissue,1.0
196,วิสกัสเพาซ์ปลาซาบะ,cat wet food,1.0
197,มอคโคน่าซีเล็คขวด,instant coffee,1.0
198,เปาวินวอชลิควิดสีส้ม,liquid detergent,1.0
199,มาดามเฮงสบู่เมอรี่เบลล์,bar soap,1.0
200,ออรัลเฮิร์บยาสีฟันสมุนไพร,toothpaste,1.0
201,ดีนี่สบู่เหลวชมพู,liquid soap,1.0
202,วาสลีนเมนเซรั่มโททัลแฟเนส,body lotion,1.0
203,แพนทีนแชมพูสมูทแอนด์ซิลกี้,shampoo,1.0
204,ฟริสกี้ส์ปลาทะเล,cat dry food,1.0
205,โลแลนคูลอีซี่ครีมน้ำตาลทองแดง(M),hair coloring,1.0
206,ดาร์ลี่ยาสีฟันดับเบิ้ลแอคชั่นx,toothpaste,1.0
207,สไปรท์,flavored soft drinks,1.0
208,แพลนเต้พิ้งค์เอ็กซ์ตร้าไวท์โลชั่น.,body lotion,1.0
209,ยำยำช้างน้อยข้าวโพด,instant noodles,1.0
210,ฟลูโอคารีลยาสีฟัน,toothpaste,1.0
211,หอยหลอดน้ำปลารสกลมกล่อมขวดเพท,fish sauce,1.0
212,ไฟน์ไลน์ซักผ้าเข้มข้นชมพู,liquid detergent,1.0
213,เลย์ร็อครสเกลือ,potato chips,1.0
214,ยิลเลตต์ด้ามมีดเว็คเตอร์,shaving and hair remover,1.0
215,ลูโก้เจลปรับอากาศกลิ่นเมลโล่ป๊อป,continuous air fresheners,1.0
216,เรโซน่าโรลออนคอตตอนสีฟ้า,deodorants and body scent,1.0
217,เป๊ปซี่แมกซ์กระป๋อง,cola,1.0
218,อิงอรอาบน้ำมะขามแท้,bar soap,1.0
219,สมาร์ทฮาร์ทสุนัขโตเนื้ออบ.,dog dry food,1.0
220,ดาร์ลี่ยาสีฟันเกลือสมุนไพรโพรเทค,toothpaste,1.0
221,โชกุฯอาบน้ำผิวขาวสีเขียวถุง,liquid soap,1.0
222,เถ้าแก่น้อยสาหร่ายทอดรสเผ็ด,seasoned seaweed,1.0
223,โค้กสูตรไม่มีน้ำตาลกลิ่นออร์เรนจ์.,cola,1.0
224,เบอร์ดี้.,ready to drink coffee,1.0
225,แอทแทคอีซี่สูตรนุ่มรีดง่าย,powder detergent,1.0
226,สไปรท์.,flavored soft drinks,1.0
227,บลัชมีแปรงสีฟันเพิร์ลซอฟท์ปลายเรียว,toothbrush,1.0
228,คนอร์ซุปก้อนรสไก่,msg bouillon cube and powder,1.0
229,มะลินมข้นหวานหลอดบีบ,condensed milk,1.0
230,ชาวเกาะกะทิอบควันเทียน,coconut milk,1.0
231,นกพิราบผักกาดดองเผ็ดหวาน,canned vegetables,1.0
232,บีไนซ์อาบน้ำมีซทีคไวท์ชมพูเข้ม,liquid soap,1.0
233,คนอร์ซุปก้อนรสหมู,msg bouillon cube and powder,1.0
234,เจอร์ไฮสติ๊กสตอเบอรี่,pet snacks and treats,1.0
235,คอมฟอร์ทลักชัวรี่ปรับผ้าสีม่วง,fabric softener,1.0
236,ไฮเตอร์สีฟ้า,bleach and stain remover,1.0
237,โอเลย์ครีมโททัลแอนตี้เอจจิ้งไนท์,facial moisturizer,1.0
238,โก๋แก่ถั่วปากอ้าอบเกลือ,nuts and seed snacks,1.0
239,ซีโร่ถุงขยะดำx,garbage bags,1.0
240,ไลปอนล้างจานชามะนาว,dish detergent,1.0
241,ทาโร่รสสาหร่ายเกาหลี,seafood snacks,1.0
242,มีนาวดินสอเขียนคิ้วสีน้ำตาล(),eyes and brows,1.0
243,คอลเกตยาสีฟันสดชื่นเย็นซ่า,toothpaste,1.0
244,เคลล็อกส์คอร์นเฟลกส์สตรอเบอร์รี่,cereal,1.0
245,โดฟแชมพูเธอราพีสีน้ำเงิน,shampoo,1.0
246,ไบกอนยาจุดกันยุงแบบขดลาเวนเดอร์x,insecticide coils,1.0
247,เบิดวิงซ์ครีมเทียมข้นหวาน,condensed milk,1.0
248,ซีพีโบโลน่าหมูพริก,ham and bacon,1.0
249,บีไนซ์อาบน้ำแดง,liquid soap,1.0
250,โมโมญ่าอายบราวพาเลทพริตตี้บีบี().,eyes and brows,1.0
251,โดฟครีมนวดสีน้ำเงิน,hair conditioner,1.0
252,เนสกาแฟเรดคัพMRC-ARC,instant coffee,1.0
253,ไฟท์ขจัดคราบ,bleach and stain remover,1.0
254,อาทพลัสยาจุดกันยุงแบบขดซากุระ,insecticide coils,1.0
255,ยิลเลตต์ด้ามมีดบลูพลัสไพวอทx,shaving and hair remover,1.0
256,รสดีซุปก้อนรสหมู,msg bouillon cube and powder,1.0
257,เซนกะวิปโฟมเพอร์เฟ็คคอลลาเจนอิน,facial cleanser,1.0
258,คอลเกตยาสีฟันซอลท์ไวท์เทนนิ่ง,toothpaste,1.0
259,อาทพลัสยาจุดกันยุงควันน้อยลาเวนเดอร์,insecticide coils,1.0
260,ลักส์อาบน้ำสีขาว,liquid soap,1.0
261,ซัมยังฮอตชิคเก้นราเมง,instant noodles,1.0
262,ฟิชเชอร์แมนเฟรนช์มิกซ์เบอร์รี่,hard candies,1.0
263,แปรงขัดพื้นด้ามยาว(),scrub brushes and toilet scrubbers,1.0
264,ดับเบิ้ลเดกเกอร์ข้าวเกรียบกุ้ง,prawn chips,1.0
265,เพดดิกรีสุนัขโตเนื้อวัวและผัก,dog dry food,1.0
266,เคลียร์แชมพูสีฟ้า,shampoo,1.0
267,นีเวียดีโอโรลออนเอ็กตร้าไวท์เทนนิ่ง,deodorants and body scent,1.0
268,เป๊บซี่,cola,1.0
269,ไฮคลาสปรับผ้านุ่มเนเจอร์เฮฟเว่น,fabric softener,1.0
270,ไวตามิ้ลค์สูตรโลว์ชูการ์,uht dairy free,1.0
271,ไวไวควิกต้มยำกุ้ง,instant noodles,1.0
